{
  "$schema": "http://json-schema.org/draft-07/schema#",
  "description": "",
  "type": "array",
  "items": {
    "description": "",
    "type": "object",
    "properties": {
      "rowIdentifier": {
        "description": "",
        "type": "number"
      },
      "authorizationId": {
        "description": "",
        "type": "number"
      },
      "patientId": {
        "description": "",
        "type": "number"
      },
      "codeType": {
        "description": "",
        "type": "string"
      },
      "code": {
        "description": "",
        "type": "string"
      },
      "codeDescription": {
        "description": "",
        "type": "string"
      },
      "sortOrder": {
        "description": "",
        "type": "number"
      }
    }
  }
}